<?xml version="1.0"?>
<!DOCTYPE Report
[
<!ELEMENT Report (General ,(Doc|BPT)) >
<!ATTLIST Report ver CDATA #REQUIRED tmZone CDATA #REQUIRED>

<!ELEMENT General ( DocLocation ) >
<!ATTLIST General productName CDATA #REQUIRED productVer CDATA #REQUIRED os CDATA #REQUIRED host CDATA #REQUIRED qcserver CDATA #IMPLIED qcproject CDATA #IMPLIED SolManSolutionId CDATA #IMPLIED SolManProjectId CDATA #IMPLIED SolManTestPlanId CDATA #IMPLIED SolManTestPackageId CDATA #IMPLIED SolManUserInfoData CDATA #IMPLIED  >

<!ELEMENT BPT (DName,Res,DVer?,TSet?,TInst?,NodeArgs,AdditionalInfo*,Doc*) >
<!ATTLIST BPT rID ID #REQUIRED >

<!ELEMENT Doc (DName,ConfName?,Res,DVer?,TSet?,TInst?,RunType?,DT?,AdditionalInfo*,Step*,DIter*,Step*,Action*,Doc*,Summary?,TestMaintenanceSummary*,NodeArgs?) >
<!ATTLIST Doc rID ID #REQUIRED type (Test|BC|BPTWrapperTest|Flow|Group|Action) "Test" productName CDATA #REQUIRED BCIter CDATA #IMPLIED >

<!ELEMENT RunType ( #PCDATA )>
<!ATTLIST RunType fmStep (False|True) "False" batch (False|True) "False" upDesc (False|True) "False" upChk (False|True) "False" upAS (False|True) "False">

<!ELEMENT DName ( #PCDATA ) >

<!ELEMENT ConfName ( #PCDATA ) >

<!ELEMENT Res ( #PCDATA ) >

<!ELEMENT AdditionalInfo (AdditionalDataName,AdditionalDataValue ) >

<!ELEMENT AdditionalDataName ( #PCDATA ) >

<!ELEMENT AdditionalDataValue ( #PCDATA ) >

<!ELEMENT DVer ( #PCDATA ) >

<!ELEMENT TSet ( #PCDATA ) >

<!ELEMENT TInst ( #PCDATA ) >

<!ELEMENT DIter (Step*,Action+,Summary?,NodeArgs)>
<!ATTLIST DIter rID ID #REQUIRED iterID CDATA #REQUIRED>

<!ELEMENT DocLocation ( #PCDATA )>

<!ELEMENT Action (AName,AIter*,(Step|HtmlStep|Action)*, Summary,ActionMaintenanceSummary*, NodeArgs ) >
<!ATTLIST Action rID ID #REQUIRED>

<!ELEMENT AIter ((Step|HtmlStep|Action)*,DataMapping?, Summary?,NodeArgs) >
<!ATTLIST AIter rID ID #REQUIRED iterID CDATA #REQUIRED isCountable (False|True) "False" >

<!ELEMENT AName ( #PCDATA ) >

<!ELEMENT TestMaintenanceSummary (ActionMaintenanceSummary*) >
<!ATTLIST TestMaintenanceSummary ObjectsAdded CDATA #REQUIRED ObjectsUpdated CDATA #REQUIRED StepsUpdated CDATA #REQUIRED StepsComments CDATA #REQUIRED><!ELEMENT ActionMaintenanceSummary (ObjectChange* ) >
<!ATTLIST ActionMaintenanceSummary Action CDATA #REQUIRED Objects CDATA #REQUIRED Updated CDATA #REQUIRED LinesTotal CDATA #REQUIRED Added CDATA #REQUIRED LinesUpdated CDATA #REQUIRED>

<!ELEMENT ObjectChange  (Hierarchy, PropertyChangeList* ) >
<!ATTLIST ObjectChange Operation CDATA #IMPLIED OriginalRepository CDATA #IMPLIED>

<!ELEMENT PropertyChangeList (PropertyDef*) >

<!ELEMENT PropertyDef (OriginalValue, NewValue) >
<!ATTLIST PropertyDef PropName CDATA #REQUIRED OriginRegularExpression (True|False) "False" NewRegularExpression (True|False) "False" AddedProperty (True|False) "False" >

<!ELEMENT OriginalValue ( #PCDATA )>

<!ELEMENT NewValue ( #PCDATA )>

<!ELEMENT Hierarchy  (ObjectName, Hierarchy*) >
<!ATTLIST Hierarchy MicClass CDATA #REQUIRED>

<!ELEMENT ObjectName  ( #PCDATA ) >

<!ELEMENT Step (Obj,Details,Time,TimeTick* ,(Step|HtmlStep|Doc)*, DataMapping?, NodeArgs) >
<!ATTLIST Step rID ID #REQUIRED retval CDATA #IMPLIED>

<!ELEMENT HtmlStep (HTML,TimeTick*,(Step|HtmlStep|Doc)*,NodeArgs) >
<!ATTLIST HtmlStep rID ID #REQUIRED >

<!ELEMENT Obj ( #PCDATA ) >
<!ATTLIST Obj plainTxt (False|True) "True">

<!ELEMENT Details ( #PCDATA ) >
<!ATTLIST Details plainTxt (False|True) "True">

<!ELEMENT Time ( #PCDATA ) >

<!ELEMENT HTML ( #PCDATA ) >

<!ELEMENT Disp ( #PCDATA ) >

<!ELEMENT TimeTick ( #PCDATA ) >

<!ELEMENT DataMapping ( DataMappedItem* )>
<!ELEMENT DataMappedItem EMPTY >
<!ATTLIST DataMappedItem dsName CDATA #REQUIRED >
<!ATTLIST DataMappedItem rowId CDATA #REQUIRED >

<!ELEMENT NodeArgs (Disp,TopPane?,BtmPane?,ExtendedInfo? )>
<!ATTLIST NodeArgs eType CDATA #REQUIRED icon CDATA #REQUIRED nRep CDATA #REQUIRED UserNote CDATA #IMPLIED filter (False|True) "True">
<!ATTLIST NodeArgs status (Passed|Failed|Done|Warning|Information) "Done">
<!ATTLIST NodeArgs iconSel CDATA #IMPLIED nType CDATA #IMPLIED MovieMarker CDATA "">
<!ATTLIST NodeArgs Source CDATA #IMPLIED SourceLine CDATA #IMPLIED StepFlowItemKey CDATA #IMPLIED >

<!ELEMENT TopPane (Path)>

<!ELEMENT BtmPane ( (Path|WR)?,ASHilite?)>
<!ATTLIST BtmPane vType CDATA "HTML">

<!ELEMENT Path ( #PCDATA ) >

<!ELEMENT ASHilite ( #PCDATA ) >

<!ELEMENT WR ( #PCDATA ) >

<!ELEMENT ExtendedInfo ( StepData ) >

<!ATTLIST ExtendedInfo StepType CDATA #REQUIRED>
<!ELEMENT DT (NodeArgs) >
<!ATTLIST DT rID ID #REQUIRED>

<!ELEMENT Summary (Param*)>
<!ATTLIST Summary sTime CDATA #IMPLIED eTime CDATA #IMPLIED passed CDATA #IMPLIED failed CDATA #IMPLIED warnings CDATA #IMPLIED retval CDATA #IMPLIED stopped (False|True) "False" >

<!ELEMENT Param (ParamName,ParamVal)+ >
<!ATTLIST Param paramInOut (In|Out) "In">

<!ELEMENT ParamName ( #PCDATA ) >

<!ELEMENT ParamVal ( #PCDATA ) >

]
>
<Report ver="2.0" tmZone="SE Asia Standard Time">
<General productName="HPE Unified Functional Testing" productVer="14.0" os="" host="HONGNT-PC"><DocLocation><![CDATA[D:\Demo ALM Octane Lab\TestScript\Test GUI]]></DocLocation></General>
<Doc rID="T1"   productName= "HPE Unified Functional Testing"  >
<DName><![CDATA[Test GUI]]></DName>
<Res><![CDATA[Test GUI]]></Res>
<DT rID="T2">
<NodeArgs eType="Table" icon="2" nRep="4" filter="False" >
<Disp><![CDATA[Run-Time Data Table]]></Disp>
<BtmPane vType="Table" >
<Path><![CDATA[Default.xls]]></Path>
</BtmPane>
</NodeArgs>
</DT>
<DIter rID="T3" iterID="1" >
<Action rID="T4">
<AName><![CDATA[Action1]]></AName>
<Step rID="T5">
<Obj plainTxt="False" ><![CDATA[SystemUtil]]></Obj>
<Details plainTxt="False" ><![CDATA[SystemUtil]]></Details>
<Time><![CDATA[6/14/2018 - 15:10:22]]></Time>
<TimeTick>1528963822</TimeTick>
<Step rID="T6">
<Obj plainTxt="False" ><![CDATA[Run "C:\Program Files (x86)\HP\Unified Functional Testing\samples\Flights Application\FlightsGUI.exe",1]]></Obj>
<Details plainTxt="False" ><![CDATA[Run "C:\Program Files (x86)\HP\Unified Functional Testing\samples\Flights Application\FlightsGUI.exe",1]]></Details>
<Time><![CDATA[6/14/2018 - 15:10:22]]></Time>
<TimeTick>1528963822</TimeTick>
<NodeArgs eType="Replay" icon="5" nRep="11" status="Passed" Source="Action1" SourceLine="-1" >
<Disp><![CDATA[Run "C:\Program Files (x86)\HP\Unified Functional Testing\samples\Flights Application\FlightsGUI.exe",1]]></Disp>
</NodeArgs>
</Step>
<NodeArgs eType="Replay" icon="5" nRep="10" status="Passed" Source="Action1" SourceLine="-1" >
<Disp><![CDATA[SystemUtil]]></Disp>
</NodeArgs>
</Step>
<Step rID="T7">
<Obj plainTxt="False" ><![CDATA[Run Error]]></Obj>
<Details plainTxt="False" ><![CDATA[The &quot;HPE MyFlight Sample Applicatio&quot;  object was not found in the Object Repository.<BR/>Check the Object Repository to confirm that the object exists or to find the correct name for the object.<BR/>Line (4): &quot;WpfWindow(&quot;HPE MyFlight Sample Applicatio&quot;).WpfEdit(&quot;agentName&quot;).Set &quot;john&quot;&quot;. ]]></Details>
<Time><![CDATA[6/14/2018 - 15:10:22]]></Time>
<TimeTick>1528963822</TimeTick>
<NodeArgs eType="Replay" icon="6" nRep="12" status="Failed" Source="Action1" SourceLine="3" >
<Disp><![CDATA[Run Error]]></Disp>
</NodeArgs>
</Step>
<Step rID="T8">
<Obj plainTxt="False" ><![CDATA[Run Error]]></Obj>
<Details plainTxt="False" ><![CDATA[The &quot;HPE MyFlight Sample Applicatio&quot;  object was not found in the Object Repository.<BR/>Check the Object Repository to confirm that the object exists or to find the correct name for the object.<BR/>Line (5): &quot;WpfWindow(&quot;HPE MyFlight Sample Applicatio&quot;).WpfEdit(&quot;password&quot;).SetSecure &quot;5b067a79b206b2b3ba2c&quot;&quot;. ]]></Details>
<Time><![CDATA[6/14/2018 - 15:10:22]]></Time>
<TimeTick>1528963822</TimeTick>
<NodeArgs eType="Replay" icon="6" nRep="13" status="Failed" Source="Action1" SourceLine="4" >
<Disp><![CDATA[Run Error]]></Disp>
</NodeArgs>
</Step>
<Step rID="T9">
<Obj plainTxt="False" ><![CDATA[Run Error]]></Obj>
<Details plainTxt="False" ><![CDATA[The &quot;HPE MyFlight Sample Applicatio&quot;  object was not found in the Object Repository.<BR/>Check the Object Repository to confirm that the object exists or to find the correct name for the object.<BR/>Line (8): &quot;name = (WpfWindow(&quot;HPE MyFlight Sample Applicatio&quot;).WpfEdit(&quot;agentName&quot;).GetROProperty(&quot;text&quot;))&quot;. ]]></Details>
<Time><![CDATA[6/14/2018 - 15:10:22]]></Time>
<TimeTick>1528963822</TimeTick>
<NodeArgs eType="Replay" icon="6" nRep="14" status="Failed" Source="Action1" SourceLine="7" >
<Disp><![CDATA[Run Error]]></Disp>
</NodeArgs>
</Step>
<Step rID="T10">
<Obj ><![CDATA[Check độ dài Username]]></Obj>
<Details ><![CDATA[Username  dài 0 kí tự]]></Details>
<Time><![CDATA[6/14/2018 - 15:10:22]]></Time>
<TimeTick>1528963822</TimeTick>
<NodeArgs eType="User" icon="7" nRep="15" status="Failed" Source="Action1" SourceLine="7" >
<Disp><![CDATA[Check độ dài Username]]></Disp>
</NodeArgs>
</Step>
<Step rID="T11">
<Obj plainTxt="False" ><![CDATA[Run Error]]></Obj>
<Details plainTxt="False" ><![CDATA[The &quot;HPE MyFlight Sample Applicatio&quot;  object was not found in the Object Repository.<BR/>Check the Object Repository to confirm that the object exists or to find the correct name for the object.<BR/>Line (19): &quot;WpfWindow(&quot;HPE MyFlight Sample Applicatio&quot;).WpfButton(&quot;OK&quot;).Click&quot;. ]]></Details>
<Time><![CDATA[6/14/2018 - 15:10:22]]></Time>
<TimeTick>1528963822</TimeTick>
<NodeArgs eType="Replay" icon="6" nRep="16" status="Failed" Source="Action1" SourceLine="18" >
<Disp><![CDATA[Run Error]]></Disp>
</NodeArgs>
</Step>
<Step rID="T12">
<Obj plainTxt="False" ><![CDATA[Run Error]]></Obj>
<Details plainTxt="False" ><![CDATA[The &quot;HPE MyFlight Sample Applicatio&quot;  object was not found in the Object Repository.<BR/>Check the Object Repository to confirm that the object exists or to find the correct name for the object.<BR/>Line (22): &quot;WpfWindow(&quot;HPE MyFlight Sample Applicatio&quot;).WpfButton(&quot;FIND FLIGHTS&quot;).Click&quot;. ]]></Details>
<Time><![CDATA[6/14/2018 - 15:10:22]]></Time>
<TimeTick>1528963822</TimeTick>
<NodeArgs eType="Replay" icon="6" nRep="17" status="Failed" Source="Action1" SourceLine="21" >
<Disp><![CDATA[Run Error]]></Disp>
</NodeArgs>
</Step>
<Step rID="T13">
<Obj plainTxt="False" ><![CDATA[Run Error]]></Obj>
<Details plainTxt="False" ><![CDATA[The &quot;HPE MyFlight Sample Applicatio&quot;  object was not found in the Object Repository.<BR/>Check the Object Repository to confirm that the object exists or to find the correct name for the object.<BR/>Line (23): &quot;WpfWindow(&quot;HPE MyFlight Sample Applicatio&quot;).WpfTable(&quot;flightsDataGrid&quot;).SelectCell 4,0&quot;. ]]></Details>
<Time><![CDATA[6/14/2018 - 15:10:22]]></Time>
<TimeTick>1528963822</TimeTick>
<NodeArgs eType="Replay" icon="6" nRep="18" status="Failed" Source="Action1" SourceLine="22" >
<Disp><![CDATA[Run Error]]></Disp>
</NodeArgs>
</Step>
<Step rID="T14">
<Obj plainTxt="False" ><![CDATA[Run Error]]></Obj>
<Details plainTxt="False" ><![CDATA[The &quot;HPE MyFlight Sample Applicatio&quot;  object was not found in the Object Repository.<BR/>Check the Object Repository to confirm that the object exists or to find the correct name for the object.<BR/>Line (24): &quot;WpfWindow(&quot;HPE MyFlight Sample Applicatio&quot;).WpfButton(&quot;SELECT FLIGHT&quot;).Click&quot;. ]]></Details>
<Time><![CDATA[6/14/2018 - 15:10:23]]></Time>
<TimeTick>1528963823</TimeTick>
<NodeArgs eType="Replay" icon="6" nRep="19" status="Failed" Source="Action1" SourceLine="23" >
<Disp><![CDATA[Run Error]]></Disp>
</NodeArgs>
</Step>
<Step rID="T15">
<Obj plainTxt="False" ><![CDATA[Run Error]]></Obj>
<Details plainTxt="False" ><![CDATA[The &quot;HPE MyFlight Sample Applicatio&quot;  object was not found in the Object Repository.<BR/>Check the Object Repository to confirm that the object exists or to find the correct name for the object.<BR/>Line (25): &quot;WpfWindow(&quot;HPE MyFlight Sample Applicatio&quot;).WpfEdit(&quot;passengerName&quot;).Set DataTable(&quot;PassengerName&quot;, dtGlobalSheet)&quot;. ]]></Details>
<Time><![CDATA[6/14/2018 - 15:10:23]]></Time>
<TimeTick>1528963823</TimeTick>
<NodeArgs eType="Replay" icon="6" nRep="20" status="Failed" Source="Action1" SourceLine="24" >
<Disp><![CDATA[Run Error]]></Disp>
</NodeArgs>
</Step>
<Step rID="T16">
<Obj plainTxt="False" ><![CDATA[Run Error]]></Obj>
<Details plainTxt="False" ><![CDATA[The &quot;HPE MyFlight Sample Applicatio&quot;  object was not found in the Object Repository.<BR/>Check the Object Repository to confirm that the object exists or to find the correct name for the object.<BR/>Line (26): &quot;WpfWindow(&quot;HPE MyFlight Sample Applicatio&quot;).WpfButton(&quot;ORDER&quot;).Click&quot;. ]]></Details>
<Time><![CDATA[6/14/2018 - 15:10:23]]></Time>
<TimeTick>1528963823</TimeTick>
<NodeArgs eType="Replay" icon="6" nRep="21" status="Failed" Source="Action1" SourceLine="25" >
<Disp><![CDATA[Run Error]]></Disp>
</NodeArgs>
</Step>
<Step rID="T17">
<Obj plainTxt="False" ><![CDATA[Run Error]]></Obj>
<Details plainTxt="False" ><![CDATA[The &quot;HPE MyFlight Sample Applicatio&quot;  object was not found in the Object Repository.<BR/>Check the Object Repository to confirm that the object exists or to find the correct name for the object.<BR/>Line (30): &quot;order_mes = (WpfWindow(&quot;HPE MyFlight Sample Applicatio&quot;).WpfObject(&quot;Order 89 completed&quot;).GetROProperty(&quot;text&quot;))&quot;. ]]></Details>
<Time><![CDATA[6/14/2018 - 15:10:28]]></Time>
<TimeTick>1528963828</TimeTick>
<NodeArgs eType="Replay" icon="6" nRep="22" status="Failed" Source="Action1" SourceLine="29" >
<Disp><![CDATA[Run Error]]></Disp>
</NodeArgs>
</Step>
<Step rID="T18">
<Obj plainTxt="False" ><![CDATA[Run Error]]></Obj>
<Details plainTxt="False" ><![CDATA[The &quot;HPE MyFlight Sample Applicatio&quot;  object was not found in the Object Repository.<BR/>Check the Object Repository to confirm that the object exists or to find the correct name for the object.<BR/>Line (42): &quot;WpfWindow(&quot;HPE MyFlight Sample Applicatio&quot;).WpfButton(&quot;NEW SEARCH&quot;).Click&quot;. ]]></Details>
<Time><![CDATA[6/14/2018 - 15:10:28]]></Time>
<TimeTick>1528963828</TimeTick>
<NodeArgs eType="Replay" icon="6" nRep="23" status="Failed" Source="Action1" SourceLine="41" >
<Disp><![CDATA[Run Error]]></Disp>
</NodeArgs>
</Step>
<Step rID="T19">
<Obj plainTxt="False" ><![CDATA[Run Error]]></Obj>
<Details plainTxt="False" ><![CDATA[The &quot;HPE MyFlight Sample Applicatio&quot;  object was not found in the Object Repository.<BR/>Check the Object Repository to confirm that the object exists or to find the correct name for the object.<BR/>Line (43): &quot;WpfWindow(&quot;HPE MyFlight Sample Applicatio&quot;).WpfTabStrip(&quot;WpfTabStrip&quot;).Select &quot;SEARCH ORDER&quot;&quot;. ]]></Details>
<Time><![CDATA[6/14/2018 - 15:10:28]]></Time>
<TimeTick>1528963828</TimeTick>
<NodeArgs eType="Replay" icon="6" nRep="24" status="Failed" Source="Action1" SourceLine="42" >
<Disp><![CDATA[Run Error]]></Disp>
</NodeArgs>
</Step>
<Step rID="T20">
<Obj plainTxt="False" ><![CDATA[Run Error]]></Obj>
<Details plainTxt="False" ><![CDATA[The &quot;HPE MyFlight Sample Applicatio&quot;  object was not found in the Object Repository.<BR/>Check the Object Repository to confirm that the object exists or to find the correct name for the object.<BR/>Line (44): &quot;WpfWindow(&quot;HPE MyFlight Sample Applicatio&quot;).WpfRadioButton(&quot;byNumberRadio&quot;).Set&quot;. ]]></Details>
<Time><![CDATA[6/14/2018 - 15:10:28]]></Time>
<TimeTick>1528963828</TimeTick>
<NodeArgs eType="Replay" icon="6" nRep="25" status="Failed" Source="Action1" SourceLine="43" >
<Disp><![CDATA[Run Error]]></Disp>
</NodeArgs>
</Step>
<Step rID="T21">
<Obj plainTxt="False" ><![CDATA[Run Error]]></Obj>
<Details plainTxt="False" ><![CDATA[The &quot;HPE MyFlight Sample Applicatio&quot;  object was not found in the Object Repository.<BR/>Check the Object Repository to confirm that the object exists or to find the correct name for the object.<BR/>Line (45): &quot;WpfWindow(&quot;HPE MyFlight Sample Applicatio&quot;).WpfEdit(&quot;byNumberWatermark&quot;).Set order_num&quot;. ]]></Details>
<Time><![CDATA[6/14/2018 - 15:10:28]]></Time>
<TimeTick>1528963828</TimeTick>
<NodeArgs eType="Replay" icon="6" nRep="26" status="Failed" Source="Action1" SourceLine="44" >
<Disp><![CDATA[Run Error]]></Disp>
</NodeArgs>
</Step>
<Step rID="T22">
<Obj plainTxt="False" ><![CDATA[Run Error]]></Obj>
<Details plainTxt="False" ><![CDATA[The &quot;HPE MyFlight Sample Applicatio&quot;  object was not found in the Object Repository.<BR/>Check the Object Repository to confirm that the object exists or to find the correct name for the object.<BR/>Line (46): &quot;WpfWindow(&quot;HPE MyFlight Sample Applicatio&quot;).WpfButton(&quot;SEARCH&quot;).Click&quot;. ]]></Details>
<Time><![CDATA[6/14/2018 - 15:10:28]]></Time>
<TimeTick>1528963828</TimeTick>
<NodeArgs eType="Replay" icon="6" nRep="27" status="Failed" Source="Action1" SourceLine="45" >
<Disp><![CDATA[Run Error]]></Disp>
</NodeArgs>
</Step>
<Step rID="T23">
<Obj plainTxt="False" ><![CDATA[Run Error]]></Obj>
<Details plainTxt="False" ><![CDATA[The &quot;HPE MyFlight Sample Applicatio&quot;  object was not found in the Object Repository.<BR/>Check the Object Repository to confirm that the object exists or to find the correct name for the object.<BR/>Line (50): &quot;WpfWindow(&quot;HPE MyFlight Sample Applicatio&quot;).Close&quot;. ]]></Details>
<Time><![CDATA[6/14/2018 - 15:10:28]]></Time>
<TimeTick>1528963828</TimeTick>
<NodeArgs eType="Replay" icon="6" nRep="28" status="Failed" Source="Action1" SourceLine="49" >
<Disp><![CDATA[Run Error]]></Disp>
</NodeArgs>
</Step>
<Summary sTime="6/14/2018 - 15:10:21" eTime="6/14/2018 - 15:10:28" passed="1" failed="17" warnings="0" ></Summary>
<NodeArgs eType="StartAction" icon="4" nRep="7" status="Failed" >
<Disp><![CDATA[Action1 Summary]]></Disp>
</NodeArgs>
</Action>
<NodeArgs eType="StartIteration" icon="3" nRep="6" status="Failed" >
<Disp><![CDATA[Test GUI Iteration 1 (Row 1)]]></Disp>
</NodeArgs>
</DIter>
<Summary sTime="6/14/2018 - 15:10:20" eTime="6/14/2018 - 15:10:28" passed="1" failed="17" warnings="0" ></Summary>
<NodeArgs eType="StartTest" icon="1" nRep="3" status="Failed" >
<Disp><![CDATA[Test Test GUI Summary]]></Disp>
</NodeArgs>
</Doc>
</Report>